Phone Name,Review
iphone 14,Performance - Amazing.UI exp- amazing...its simple. But sometime annoy.Battery- around 9hr normal usage(camera use).  Pubg game - 6hr apprx.Display- its good but I do not like to watch movies or tv series in 6.1 size screen. Better go for plus model.This size is handy.Gaming - sometime get sticky (due to heating) while playing pubg (HD quality). But overall run smooth. Do not forget to enable gaming mode and and guided acces.I find this phone suitable for daily purpose. It take less ti...READ MORE
iphone 14,BestREAD MORE
iphone 14,"I had upgraded from XR to 14.. So it’s amazing❤️ But if you are already using 13 means, either upgrade it to 14 pro or don’t buy this.Ditto as iPhone 13.READ MORE"
iphone 14,Worth of money.!READ MORE
iphone 14,Handy. Premium fellingREAD MORE
iphone 14,Iphone14=camera+battery +processor with brandREAD MORE
iphone 14,Excellent phoneREAD MORE
iphone 14,Lovely phone.. camera is very good 👍Awesome product.....READ MORE
iphone 14,"Powerful A15 Bionic chipLong-lasting battery lifeImproved camerasNew Cinematic mode for videoSleek and durable designSharp and vibrant display5G connectivityiOS 16 with new features and customizationsAvailable in four colors: Midnight, Starlight, Product Red, and PurpleREAD MORE"
iphone 14,Without doubt my first iphone proved that it is far better than Android phones. Battery may not work more than 15 hours if you have lot of calls and activities. 14 and 14 plus both are excellent since my colleague purchased 14 plus since he need bigger display. You can go for any 14 series according to your requirements.READ MORE
iphone 14,Great product at this price range i am very happy to get this productREAD MORE
iphone 14,Nice product liked itREAD MORE
iphone 14,SuperREAD MORE
iphone 14,Tq Flipkart ❣️READ MORE
iphone 14,Battery performance is too bad . Battery health goes down to 97 in just two monthsREAD MORE
iphone 14,Phone is good but some bugs in the phone.Camera is good Performance is goodDesign is goodBattery performance is ok Purchased that phone in January  and battery perform good when you have low usage and in heavy usage battery draining fast.READ MORE
iphone 14,Superb phone. Design could have been new but good performance . Purple color looks pretty decent. Light shade.READ MORE
iphone 14,Just loving it❣️READ MORE
iphone 14,AwesomeREAD MORE
iphone 14,"First iPhone I'm so excited 🙃 It is wonderful, good battery performance for gamer ✌️READ MORE"
iphone 14,The phone is simply incredible. Very smooth and camera is awesome.READ MORE
iphone 14,Awesome phoneREAD MORE
iphone 14,Good overall camera. Good specifications. But according to me S23 performs slightly better in terms of photos and portraits.READ MORE
iphone 14,Super mobile 😘😘READ MORE
iphone 14,"Overall good experience (4 months review)Display : 60hz but impressive,Camera: if lighting condition is good then it can click very good photos but incase of poor lighting not good experience at such price point.Battery: It can give 5-6 hr of screentime, it can sustain whole day with single charge.but Battery health reduces 1% in my 4 months of usage which is quite shocking for me.Charging: Charging speed is quite good with 20w charger but at such price point it could be better.Conc...READ MORE"
iphone 14,Product good but battery not expect qualityREAD MORE
iphone 14,Pic quality is improvised.. lighter weight .. grip is better 😎🤓😎 I enjoyed it !!READ MORE
iphone 14,"Definitely go for it ,iPhone 14 best front camera everREAD MORE"
iphone 14,Value for moneyREAD MORE
iphone 14,Very good 💯READ MORE
iphone 14,This phone is good i use phone in 20 days than I realised the phone is very wellREAD MORE
iphone 14,Good 😊READ MORE
iphone 14,I upgraded from iphone 12. Much better than iphone 12. Love itREAD MORE
iphone 14,Now it's a value for money deal.Iphone 14 is a lot better than 13 in performance.READ MORE
iphone 14,GreatREAD MORE
iphone 14,One of the best brand all features are goodThanks FlipkartREAD MORE
iphone 14,Phone is awesome BUT whats up with the front camera ?! Ip6 X 11 12 13 take better pictures from front camera.READ MORE
iphone 14,Product is good...bt battary is average.READ MORE
iphone 14,Awesome purcREAD MORE
iphone 14,wow first time shifting from android to iosn its sooo amazing.. phone excels in everything be it camera to haptics to software experience.. glad i ordered iphone 14 instead of 13 there is noticable camera improvement in low light. + 50% more ram makes it future proofREAD MORE
iphone 14,Awesome phoneCamera 10/10Performance 10/10Design 10/10READ MORE
iphone 14,Awesome phone. Best performance and good in-hand feeling. Battery backup is good.READ MORE
iphone 14,Grabbed it in a good price. Nothing much to say the name is enough.Loving it and enjoying the experience.Hope it lasts longREAD MORE
iphone 14,Camera 👌Performance 👌Battery 👌In hand feel 👌Over all design ( just looking like a wow )READ MORE
iphone 14,"Camera is good, battery is ok ok. Look is very osm, feels good to have itREAD MORE"
iphone 14,Mind blowing 🤩🤩READ MORE
iphone 14,1.Awesome Display2.Good Looking3.Full day battery 🔋 backup4.Superb Camera Thanks FlipkartREAD MORE
iphone 14,Nyc product experience is very good 😊READ MORE
iphone 14,Very good praformence and very nice lovely 😍READ MORE
iphone 14,Marvellous camera and slick design 💜READ MORE
iphone 14,Awesome productREAD MORE
iphone 14,"Nice phone, light weight.READ MORE"
iphone 14,Great phone with great featuresREAD MORE
iphone 14,Camera is so good but battery is a not good but good 😊 anyway happyREAD MORE
iphone 14,All good! Works Great!READ MORE
iphone 14,Best phoneREAD MORE
iphone 14,Osm performanceREAD MORE
iphone 14,I love iPhoneREAD MORE
iphone 14,Nice good battery backup good camera must buy👍READ MORE
iphone 14,On of the best mobile phoneREAD MORE
iphone 14,ExcellentREAD MORE
iphone 14,Iphone the best in performance as always.Smooth UI . Great camera. Great performanceREAD MORE
iphone 14,Too awesome..........READ MORE
iphone 14,mind blowing performanceREAD MORE
iphone 14,I am in love with this. Upgraded from one plus. iOS is really wonderful with great features. Blue colour is wonderful. Camera and build quality is superb and stereo speaker are amazingREAD MORE
iphone 14,Super ❤️❣️READ MORE
iphone 14,Best phone everREAD MORE
iphone 14,Nice phone ❤️ I PHONE 14 ❤️READ MORE
iphone 14,Maza A gaya Nice productREAD MORE
iphone 14,🥰 lovelyREAD MORE
iphone 14,Excellent product and camera 💥READ MORE
iphone 14,Great product! Made improvements in ultra wide camera compared to iPhone 13READ MORE
iphone 14,Best iphone till nowREAD MORE
iphone 14,Very good ✌️😍😍✌️READ MORE
iphone 14,Premium ProductREAD MORE
iphone 14,BadREAD MORE
iphone 14,"The iphone 14 is a good device for day to day works, but the battery this phone has is not sufficient, it lasts long for 1 day on normal usage and on heavy usage it remains for half a day. The camera and the performance is superb but there is a drawback that the display is just of 60 hz which is not that smooth.READ MORE"
iphone 14,PamREAD MORE
iphone 14,!!!Enjoy with iphone 14 👍😎✌️ with great camera resolutionREAD MORE
iphone 14,This is my First IPhone.. And the experience is super fantastic.. The smoothness of the phone I got is unbelievable. 60hz is so well optimized.. My previous android phone was of 120hz but never felt this smooth.. Also it's so light weight and looks so premium.. Really Loved it❤️READ MORE
iphone 14,Amazing phone.READ MORE
iphone 14,Everything is good except camera.READ MORE
iphone 14,What a gadget !!!Perfect beast.READ MORE
iphone 14,"What a fabulous phone after using 1 monthI know in design it is similar to Iphone 13 but is specs aren't.There is substantial difference in display, battery, speed as compared to iPhone 13.Its-Battery easily lasts more than 1 day in moderate usage.Camera is fabulous.Display is excellent.Handy device.But heats sometimes while executing smaller tasks.I have Iphone Xs max. Its was a drastic upgrade from the same in terms of display, battery, speed ie hardware.But more concerning is ...READ MORE"
Phone Name,Review
samsung galaxy s23,"Samsung Galaxy s series great features at attractive price like always.pros.1. Killer Look with handy weight balance2. Super Smooth scrolling experience in display3. Fast Fingerprint sensor4. Audio quality super.5. Battery hold almost for a day even in heavy use not gaming.6. gaming experience very smooth without any lag.7. Phone has Reverse Charging Features to charge other gadgets wirelessly 8. camera... that is the best part of s series , awesome like always .. 9. 5g connectivity...READ MORE"
samsung galaxy s23,"Worth the wait, upgraded from Pixel 4a.READ MORE"
samsung galaxy s23,Portrait mode is excellent.Night mode performance is very good.pictures are clear and sharp.Charging speed could have been better but yes battery is optimised very well so easily lasts for a day.READ MORE
samsung galaxy s23,"Amazing Product, Light Weight, Best Camera, Handy, Compact Premium Smart Phone.READ MORE"
samsung galaxy s23,Camera and display quality is awesomeThere is no comparison in this segment.READ MORE
samsung galaxy s23,Amazing camera and Good performance..best choiceREAD MORE
samsung galaxy s23,Love itREAD MORE
samsung galaxy s23,"Amazing camera, good feel in hand, good batteryREAD MORE"
samsung galaxy s23,Camera quality is like dslr. Compact phone with powerful features. Battery is also good which last a entire day. Overall happy to choose this against iPhone 14READ MORE
samsung galaxy s23,This time Samsung does very well. Currently Best Premium Smartphone in market.READ MORE
samsung galaxy s23,Superb phone....READ MORE
samsung galaxy s23,From iphone 12 mini to this Best phoneREAD MORE
samsung galaxy s23,Finally received after 20 days in pre-order sale. Mobile is great in every aspect. Camera is perfect.READ MORE
samsung galaxy s23,Nice phone with best camera. Face id recognization average..READ MORE
samsung galaxy s23,Upgraded from iPhone 12 mini to s23. Fulfilling my need very nicely. Good camera even  better than iPhone 12 mini. Better battery performance.   I am not a gamer so don't know about gaming experience.READ MORE
samsung galaxy s23,"This is the best Android device available to those who don't like big phones but want everything that a big phone can do.Everything is super smooth here.Great camera quality and great video recording capabilities thanks to super stabilised video.Battery is great too if you don't Play too much heavy games then it will last whole day.Display is the best in the segment super bright and punchy, colours are just awesome ofcourse it is a Samsung display.Man the processor.... What a great ...READ MORE"
samsung galaxy s23,"Amazing photos, elegant designREAD MORE"
samsung galaxy s23,Superb camera. Handy size with decent battery. Display quality is outstanding.READ MORE
samsung galaxy s23,"Great phone, lovely weight balance. The in hand feel is amazing it's so lite that I barely feel it in my pocket. The images from the camera are decent too in every lighting condition. I have attached some samples with this review. I'm very satisfied with the phone. I do get around 5-6 hour of SOT which is pretty good for a phone of this size. The screen is bright and vibrant which is expected from a Samsung. I would definitely recommend if you are looking for a tiny and complete phone with al...READ MORE"
samsung galaxy s23,"Amazing camera😍😍, display, performance and design. The only problem is the battery but i think it should be fine for normal users🤩🤩READ MORE"
samsung galaxy s23,"Amazing phone by Samsung, except battery life it gives absolute flagship performance and I loved it...READ MORE"
samsung galaxy s23,"Received this beauty on 27 Feb 2023 and hands down to the performance of the phone. This is my first Samsung phone and I am very impressed. The images are spot on, stable videos and can shoot in 8k is a big plus for me. As the gen 2 is very power efficient my phone with moderate usage easily last around a day which is very impressive by a compact smart phone. Cream color is like a treat to watch. Just close your eyes and grab this amazing product by Samsung.READ MORE"
samsung galaxy s23,I like the product 🫶🏻READ MORE
samsung galaxy s23,Pros1. Great Battery 🔋 2. Great Camera 📷 👌 3. Great Display 👍 👌4. Top notch Performance 👌 5. Smooth Andriod experience. Got covered by 4 years updates along with security patches.6. Elegant and powerful.Cons1. Charger must be included in box.2. Heating issues.READ MORE
samsung galaxy s23,Nothing to say anything Wow osm 👌 mind blowing performance Love you Samsung  #s23READ MORE
samsung galaxy s23,"ABSOLUTE BEAST.🌟🌟🌟🌟🌟Camera, display, performance, design and build quality, apart from fast charging everything is outstandingREAD MORE"
samsung galaxy s23,Amazing camera.Loved the design and look and feel of the phone.Battery could have been better. However it works for me. Light weight as well.Overall its a really good phone. Didnt like iphone much from the store. Moreover it felt like I am giving up too many features in iphone and the price range is similar.  Hence got the s23 and I absolutely love this phone.READ MORE
samsung galaxy s23,"Camera, design, performance, form factor everything is top notchREAD MORE"
samsung galaxy s23,"User experience is amazing. Display and performance are top notch! Camera is also really nice, best part, photos are natural. The only draw back is battery backup and heating issue, if these two things were better this would have been the best flagship in this range.READ MORE"
samsung galaxy s23,Very very nice phone..😍😍Camera is Lub 🥰🥰🥰Display is superb..👍👍READ MORE
samsung galaxy s23,On first day phone screen went complete black while running some backup restore but after hard reset phone is working fine and not faced any problem. I was looking for compact phone for single hand use. Camera and battery life is good.READ MORE
samsung galaxy s23,Worth 💓READ MORE
samsung galaxy s23,"Nice design , handy phone  night Camra awesomeREAD MORE"
samsung galaxy s23,Very very good phone in 20204 and best flagship phone of the 2023. performance very smooth and soft  5/5Camera quality woww 5 🌟 Looks and design  5 🌟 Price also good in this price range this is the best phone for Android lovers and users.READ MORE
samsung galaxy s23,"Writing brutally honest review I have been using this beast for the last 2 weeks so I have pretty much experienced everything.I wanted a compact phone for work purposes and my usage includes 30+ calls in a day , 8-10 emails , opening 2-3 sheets as and when required. While I was searching for a compact and powerful device almost everyone suggested that I go for an iPhone 13/14. But since I've used apple I was more inclined towards Android and there're hardly any options available in Androi...READ MORE"
samsung galaxy s23,great picture quality just wow... powerful performance ....only heting problemREAD MORE
samsung galaxy s23,One word review- A Compact Beast 😍READ MORE
samsung galaxy s23,Camera is just amazing 👏 Display is Love ❤️ Battery is not that great 😒 Slightly heat 🥵READ MORE
samsung galaxy s23,"Don't panic, for couple of days battery will drain very fast and phone would be heating a lot. Once updated to latest software version above issues would get resolved.PROS: compact handy phone, call quality excellent,  internet connectivity stable and fast, camera excellent, AI features, Samsung proprietary features like Galaxy watch, wallet,  store, Knox supportCONS: battery will last a day on average to medium use, no charger provided in the box  charging time almost 90 min for 3900 mAH b...READ MORE"
samsung galaxy s23,"Waited almost 20days after prebooked Really a excellent product from Samsung,used I phone from last 4years now really enjoying using this phone 1,when compared to other flagships this phone is very less weight (so don't expect battery too much)2.camera quality is great3.mediam performance user ,sure 1day you can expect battery4.little bit heating issue when updating the OS and installing 30 more apps back to back5.face I'd and bio metric is too fast6.Over all feeling happy when using th...READ MORE"
samsung galaxy s23,Must buyIt's like robot in your ✋️READ MORE
samsung galaxy s23,"EDIT: Review after 17 months usageThere are hundreds of reviews for this device so let me get straight to the pros and cons as a normal user.Cons:1. Battery life is not as great as many reviewers say, I'm not a heavy user but if I'm traveling and using phone data the device doesn't even last a day. A hard reset did help improving the battery performance but still it hardly lasts a day. 2. Samsung is providing 45W charging speed for the Plus and Ultra models but only 25W for S23, this is d...READ MORE"
samsung galaxy s23,Samsung is a classleading product. Better than apple in all aspects like camera battery feel to use flagship phone. Thanks flipkart.READ MORE
samsung galaxy s23,Superb phone with ultra fast processor....Of course the display is best and the screen size which is very handy. Battery performance is very good....Very happy with product...#PerformanceBeastREAD MORE
samsung galaxy s23,I was using iPhone for a long time while switching back to Android I had my doubts but this phone absolutely crush the iphone last I used was 12 pro and got 14 pro for my friend well i still don't think it can go toe to toe against 14 pro but other than that it will be absolute winner in camera display sound battery backup and now there is call background we can have full screen photo on caller ID one of the thing i loved about ios and it's in this too go for it don't think twice.READ MORE
samsung galaxy s23,"After jumping from pixel 4a and edge 30 to Samsung s23, color is fab, performance and battery are very good and improved compared to previous S series. Camera and mainly video quality beats apple.READ MORE"
samsung galaxy s23,I absolutely loved the phone. It feels so premium and compact to hold it. The camera is just phenomenal. Brightness is the best in class. Absolute deal breaker!!READ MORE
samsung galaxy s23,Delivery- OntimePackage - averagefirst impression - ExcellentCamera- very gooduser-friendly and lot many featuresCompact and solidly built.Good battery backupHeating issue- this is only during charging. And it is expected behavior.READ MORE
samsung galaxy s23,"Wonderful camera performance if you love shooting must go for it, battery is quite good would last for a day if you are not a heavy user.. design is very good i must say overall a very good phone from #samsungREAD MORE"
samsung galaxy s23,Exchanged iPhone 11 for this. Worth it. Had very bad experience with Android but man this phone is buttery smooth.No heating.Battery is excellent.Ui is clean and easy to use and customise.Small and handy.Very beautiful design.Kudos Samsung.READ MORE
samsung galaxy s23,"I am giving the review after 10 months, this is a very good mobile, you will not find anything better than this in the market, till now not any issue with it ❤️❤READ MORE"
samsung galaxy s23,I switched my phone after 3.5 yrs and it's really a good phone. Good battery life for an average user like me. Display and design both are awesome.  It clicks good photos.. both day and night.The phone is really fast and smooth Finger print scanner is also great except one or two times. Metallic side designs is also greatREAD MORE
samsung galaxy s23,I got this product at 38k in big billon 128gb variant. At this price i will say i got best smartphone.Probs1) excellent design.2) light weight pocket frendly device.3) good camera4) performance is really excellent. Cons-1) videography in night not gets good results.2) little bit heating issue there if you use this device without case. But highlighting that heating issue does not affect to its performance. Thinking it is compact phone small heating problem is ignorable.Average p...READ MORE
samsung galaxy s23,"I've used it for a month now and I can say one thing for sure, This is the best phone I've used till now. I've got it for 40k after offers and exchange and I've never had a regret once. Ultra may have more advanced features, but me as a fan of handy phones, S23 feels right for me.READ MORE"
samsung galaxy s23,"the phone feel premium in hand. good design . very good display . battery is okay 5-6hrs sot. performance is top notch . camera testing pending . clicked few pictures ,sometimes greenish tint appears.will update review after one week. I was a S20FE user before.READ MORE"
samsung galaxy s23,"I got it for 50k with emi for that price it's really good and best of the best , I was having a bit confusion when I thought of upgrading my phone. When the sale came s23 had a offer so I bought it, now Im not regretting my choice ❤️READ MORE"
samsung galaxy s23,"After almost 15 days of usage, Samsung S23 has lived up to my expectations. The obvious pros are its compact form factor and splendid display. During the initial few days of usage, the phone does get warm along the metal frame while multitasking or using heavy apps, but that has settled down now with continuous optimization. It still gets slightly warm but nothing too alarming.One suggestion for those users who take a lot of pictures or videos is that the 128 GB may seem to be a little short...READ MORE"
samsung galaxy s23,Samsung trusted company 👌READ MORE
samsung galaxy s23,"This is really compact monster 😍 everytime feels excited to holding this phone in hand. Don't bother about battery life, it gives easily more than 1 day and there are wok around to improve the battery life - manage the performance profile switching from standard to light, and select 60hrtz refresh rate, and I am not a gamer, and hence for daily usage battery is sufficient, Samsung provides 4 years security and OS updates, camera clarity is very good, audio- cristal clear, oueUI is awesome, i...READ MORE"
samsung galaxy s23,"One thing is clear to me that almost everyone who has put negative reviews on battery life of this phone is stupid...... people with no damn knowledge of how hardware works..... keeping refresh rate at 120hz will obviously drain the battery of any phone faster, even if it has 20000mah battery..... bring the refresh rate down to standard and see the magic happen.... I charge my S23 beast only once in 24hrs ..... nothing comes close to the performance of this beauty..... wrote this after 2 mont...READ MORE"
samsung galaxy s23,"I upgraded to this from Redmi Note 4, so it is a very significant upgrade for me. Phone is fast, super responsive with no lag at all which is what you expect from a Snapdragon 8 gen 2 for Galaxy. I got 256 GB variant, so I have UFS 4.0 storage. Best camera and display, design wise looks awesome with thin and even bezels. Phone is a bit small which is perfect for my small palm but that means battery is also small and gives around 6 hours of screen on time. If you are just watching downloaded v...READ MORE"
samsung galaxy s23,This is the what i am waiting for.  Now i am loving it all.Camera is awesome Battery is pretty goodDisplay is totally smooth Speaker is clear and loudIt's perfect compact flagship.  You must go for it.READ MORE
samsung galaxy s23,Overall better than any other phone except for s23ultra😉READ MORE
samsung galaxy s23,Overall very good phone.if you use your mobile extensively then battery MAY disappoint you. For me battery is enough to survive whole day.Camera is good. it will take pictures close to reality. if you are relame/poco/oppo and other Chinese phone user and planning to switch to samsung then be mindful that camera selfi will take your real photo and will not apply lipstick and makeup and you may end up hating you own face.In performance department as well it is excellent.while charging ph...READ MORE
samsung galaxy s23,Very nice phone...thought of going to iphone 15/14..but jus experience in store before buying both....u will know the difference...the AI features standout on all.READ MORE
samsung galaxy s23,"Best performance, best build quality..I'm also getting great battery life..totally worth in BBD priceREAD MORE"
samsung galaxy s23,Beast with small battery 🔋 💪READ MORE
samsung galaxy s23,Battery could be better. But this is ultimately CHOTA DON. Far far better choice against iPhone. Fully powerpack and all in one. Superb phone but noticed some overheating issues..READ MORE
samsung galaxy s23,"The best small size phone (6.1 inch display) I have used.It's a Samsung flagship and they have got almost everything right - Fantastic cameras, Awesome AI, Amazing and Premium Display, Design, Size, Smooth and Excellent to use and to a good extent, even for high resource usage tasks. Battery consumption is also very well optimised and charges at a good speed.The only minor improvement per me could be, a slightly higher capacity battery and faster charging.Highly recommended S23, if you ...READ MORE"
samsung galaxy s23,In a world of big display smart phone lovers there is a very small community that wants a small and compact phone.If you are that person go for it.You will love it in every aspect.READ MORE
