Phone Name,Review
SAMSUNG Galaxy S23 FE,Everything is perfect except battery performance.READ MORE
SAMSUNG Galaxy S23 FE,"This phone samsung galaxy s23 fe is really good, sleek in design, and handy. It's camera is performing outstanding. The adapter of charger is not in the box. Only sim ejector pin and charging cable would come with the device.READ MORE"
SAMSUNG Galaxy S23 FE,Battery is pathetic. Overall good. But if you are looking  for a good battery back up phone then avoid it.READ MORE
SAMSUNG Galaxy S23 FE,"S23 FE It's OK, design and performance are okay. But battery optimization is one of the worst in the segment. Do not expect more than 4.5-5 hrs of SOT on average. It gets warm on basic stuff and while on updates and downloads of big file size it gets very hot, unable to hold in hands specially form edges.READ MORE"
SAMSUNG Galaxy S23 FE,"If Camera is your only priority and you don't like IPhone,  go for it. Otherwise battery and processor performance is not that much.READ MORE"
SAMSUNG Galaxy S23 FE,"Upgraded from Samsung M21 to this, and kept feeling amazed during the entire migration process (Samsung has really refined the Smart Switch utility to the extent that the new phone is an exact replica of the old one).The phone is a bit on the heavier side but mainly due to the metal parts and battery. It feels top notch premium, and performs buttery smooth (Note: it's slippery as it has glass on both sides so it's a good idea to have a case ready for it when it comes).The camera is stella...READ MORE"
SAMSUNG Galaxy S23 FE,"23 FE has amazing display and smoothness for day to day task which is not heavy.Small small features enhances the experience like galaxy AI, Aod, etc. However battery and warming issue tends to be one of the problems which needs to be considered before buying the product. If you're someone who uses the phone alot throughout the day, than you will need to charge your phone twice a day. The thing which also needs to be considered before buying is that it is kind of heavy weighted.Overall expe...READ MORE"
SAMSUNG Galaxy S23 FE,"Phone design nic and , everything good but battery not a good others phone,camera or video best performance .READ MORE"
SAMSUNG Galaxy S23 FE,Using it for 2months. Never faced lag in performance . No cons except batteryREAD MORE
SAMSUNG Galaxy S23 FE,Look and design of the phone is quite premium. The Performance of the phone is great. Display quality is very good and smooth. Camera quality is amazing but the battery backup and heating problem is a little bit poor.READ MORE
SAMSUNG Galaxy S23 FE,"This mobile device is experiencing an elevated temperature, reaching approximately 44 degrees Celsius, even with limited usage, such as watching a five-minute video. Regrettably, there appears to be a lack of adequate support from Flipkart in addressing this issue. Consequently, I can not recommend this product based on the aforementioned concerns.READ MORE"
SAMSUNG Galaxy S23 FE,Battery Drains Faster Heavy on weight Camera and OS is good No Fast chargingREAD MORE
SAMSUNG Galaxy S23 FE,Camera superb. Battery decent hai. Under 30k best mobile at this time. Worth buy 👍READ MORE
SAMSUNG Galaxy S23 FE,battery backup performance very badREAD MORE
SAMSUNG Galaxy S23 FE,"This  model s23 fe was offers a sleek design with a stunning display that boasts vibrant colors and sharp clarity. Performance-wise, the latest processor delivers lightning-fast speeds, making multitasking seamless. The camera system is a standout feature, providing excellent low-light performance and impressive zoom capabilities. Battery life is solid, easily lasting a full day with regular use.READ MORE"
SAMSUNG Galaxy S23 FE,"Go for it, everything is best, initially heating issue but after the update its normal and battery performance is not that great but not that bad as well...for normal user need to charge twice in a day...READ MORE"
SAMSUNG Galaxy S23 FE,Osm productREAD MORE
SAMSUNG Galaxy S23 FE,Amazing product guys 🤩❤️❤️READ MORE
SAMSUNG Galaxy S23 FE,HTML Programming run very smoothlyREAD MORE
SAMSUNG Galaxy S23 FE,ExcellentREAD MORE
SAMSUNG Galaxy S23 FE,"Camera is very good. Captures  very clear pictures in all modes.Build is also solid , just a slight problem of phone getting hang is observed couple of times.Battery backup is upto the mark , no issues .READ MORE"
SAMSUNG Galaxy S23 FE,Best phone in 36 k budget overall fells flagship phone in hand  use nice picture quality but battery backup is low in full charge used to maximum 5 to 6 hours daily task use ovell best best phone 📱READ MORE
SAMSUNG Galaxy S23 FE,Overall worthy the priceREAD MORE
SAMSUNG Galaxy S23 FE,"The Samsung S23 FE is a solid phone with several standout features. The camera quality is impressive, capturing detailed and vibrant photos. It has a premium look and feel, and the sound quality is excellent. Performance-wise, it handles tasks efficiently and smoothly. However, the battery life is a downside, as it requires charging at least twice a day.Pros:- Camera: Excellent quality, producing detailed and vibrant photos.- Design: Premium look and feel.- Sound Quality: Clear and robus...READ MORE"
SAMSUNG Galaxy S23 FE,Camera is super battery is worst just one day backup of u r using it with watch connected via Bluetooth u need to charge it by 6.00 pm again if fully charged in morningREAD MORE
SAMSUNG Galaxy S23 FE,"Feels Premium in hand, clicks amazing photos camera is a beast and features are also next level in this price range but the only problem is battery need to charge twice in a day but hope it's resolved in the updatesREAD MORE"
SAMSUNG Galaxy S23 FE,Good CameraREAD MORE
SAMSUNG Galaxy S23 FE,"Battery is the worst ,u' ll have to charge twice everyday even for normal use. And heats alot. Please dont buy this phone.READ MORE"
SAMSUNG Galaxy S23 FE,Heating very muREAD MORE
SAMSUNG Galaxy S23 FE,Everything is fine but battery is one of the worst thing in this phone I have just updated software of this phone battery goes down to 22% from 50% and it takes about 1.25 hours to charge it full.another draw back of this phone is it's bezzels I want to ask why too much bezzels in 2024FE models are good but atleast you can provide better screen like S21 feREAD MORE
SAMSUNG Galaxy S23 FE,Camera is good..design is good..performance is good..but battery backup is not good..need to charge twice a day..There is some heating problem...READ MORE
SAMSUNG Galaxy S23 FE,"Display 10Processor 10Camera 10 super excellentBattery super 👌 AI features, circle to search, interpreter very helpful No heating issue Super excellent flagship phone 📱 with brand name Samsung Worth every pennyDon't go to negative comment just go for itCamera is super excellent 👌 👏READ MORE"
SAMSUNG Galaxy S23 FE,Overheating. While recoding video temperature is 42 degree.READ MORE
SAMSUNG Galaxy S23 FE,The bestREAD MORE
SAMSUNG Galaxy S23 FE,Battery is draining like anything even without too much usageREAD MORE
SAMSUNG Galaxy S23 FE,Battery is always gets drain even it is 4500mahThe processor is excellent for camera but not for gaming and also gaming not so bad it can handle very smooth but we can notice frame drops And heating is nothing matters cus every mobile gets heated . And overall its a all rounder phone .A big 👎 for batteryREAD MORE
SAMSUNG Galaxy S23 FE,looking betterawsm phone battary backup is ok no heating issue is absorbed  dont worry it will cool fasterREAD MORE
SAMSUNG Galaxy S23 FE,"though performance is good. But battery drains out very fast even on full charge . it can get to 60% within just 45 mins. My previous phone Samsung A12 is performing much better even  after 3 years of continuous rough use.Not to Forget, It gets heated up so much you can literally cook something it feels.Very bad experience. Regretting my decision of buying it.Others might be obsessing over it's camera, AI etc. but still the basic things remains not as per expected.Really DisappointedREAD MORE"
SAMSUNG Galaxy S23 FE,Didn't listen to all the reviews. Damn too much of heating issuesREAD MORE
SAMSUNG Galaxy S23 FE,It's good  phoneREAD MORE
Phone Name,Review
vivo x90,My princess happy 😊READ MORE
vivo x90,"Best phone in this segment. I have used one plus 11 but I am not satisfied with the camera portrait performance. Vivo X90 is  awesome in every segment - Fast charging, display, feel, and in every segment .. no words for camera performance and modes.If anybody wants to buy vivo x90 just go for it blindly. Thanks to vivoREAD MORE"
vivo x90,Overall performance is excellent but need to improve on battery power.Unbeatable CameraAwesome Design and Looks Excellent Network and it's connectivityHDR Display Smooth ExperienceREAD MORE
vivo x90,"Looks and feel : 10/10Camera : 10/10Performance : 10/10Battery : 9/10Charging : 10/10Screen quality : 10/10Color os 13 is very basic,looks like very old Android version and also has very minimal customisations.Vivo need to improve its color os.looks great in hand but feels very cheap coz of no improvements and customisations in color os 13.READ MORE"
vivo x90,The product is worth it. Low light photography is so good because v2 chip optimisation. But zoom photos and regular videos are not very good. The charging speed is phenomenal.READ MORE
vivo x90,I have upgraded from vivo v20 pro to vivo x90. Camera is awesome but some features are missing in camera compare to v20 pro like there is no option to  bokeh or B/W video option....  but Patroit camera is awesome. Look is superb... 👌👌 And Mobile is good. 👍READ MORE
vivo x90,Good camera phoneREAD MORE
vivo x90,"According to my budget i ordered vivo x90 and i am so happy that i bought this phonethe battery backup is just incredible, camera is one of the best, this is my first curved screen phone i am in love with it, photos and videos are awesome, so many types of filtersjust the best phone one can own.for me there is only one con if the brightness was little more then it would be better, other than that no complaints.READ MORE"
vivo x90,Best camera mobileREAD MORE
vivo x90,Mobile is so good but flipcart service is so poor. So kindly purchase to the store...READ MORE
vivo x90,"Camera : The primary camera in daylight gives decent,a bit oversharpened images with bright colours. Portrait mode really shines and is it's usp.Night photos are also attractive with low noise and nice details.Design and performance are flagship standard.Battery charging very rapid(30min),lasts through an average days work.After nearly 8 months use I would not recommend this as your primary imaging device.  Go for the pro model now that it's price has come down  drastically. However that a...READ MORE"
vivo x90,I have buy this phone and i am writing this review after 10 day's experience Vivo X90 was nice phone but price is to high from the performance overheating more than use so my suggestion is to go with one plus.READ MORE
vivo x90,"It's an excellent model by vivo, a very good flagship mobile with all super features.READ MORE"
vivo x90,GreatREAD MORE
vivo x90,"All good doesn't feel like 64k phone ,But it like okay okay design.Havent felt any lag .If you get it in offers and exchanges then a good productREAD MORE"
vivo x90,"Superb Camera far far better then iphone cameras having higher prices, it is almost equivalent to the images captured by s23 with less then half of the price.Still Photos: AwsomeMovie Videos: AwsomeFron Camera: ABove average (not the best).Looks: AwsomeSpecs: Awsome Perfoms: nicecharging: it takes no time to go 100% but but charger is very heavy I can compromise on charging speed for lesser weight ..hahaREAD MORE"
vivo x90,best phone 📱 camera qualityREAD MORE
vivo x90,Awesome purchaseREAD MORE
vivo x90,Excellent!READ MORE
vivo x90,Very Good Buy and highly recommended but just lacks flagship a feature (wireless charging).should have included.READ MORE
vivo x90,Awesome phone with Professional level Photography. Very happy with my choice of purchasing this phone.READ MORE
vivo x90,MarvelousREAD MORE
vivo x90,This is a Very Good Phone and Value for MoneyREAD MORE
vivo x90,Beautiful product from VivoREAD MORE
vivo x90,Great cameraREAD MORE
vivo x90,GoodREAD MORE
vivo x90,Super ❤️❤️READ MORE
vivo x90,Good  mobile and alwsome camera resultsREAD MORE
vivo x90,SuperREAD MORE
vivo x90,This phone display is not good dark movies not visible properly.....😔READ MORE
vivo x90,"Battery becomes quick less. Selfie camera neeed improvement. 8k video option? , 100x zoom?.READ MORE"
vivo x90,All is well goodREAD MORE
vivo x90,"Good product for all types of users but Vivo should have to implement some extra features too through updates In this price.... Regarding the theme, font, icon size, colours change, write to uninstall unused app ......READ MORE"
vivo x90,Just speechless 🥰READ MORE
vivo x90,Display and camera are the pros of this phone.READ MORE
vivo x90,Amazing Phone.... The camera is very good.... Allrounder phoneREAD MORE
vivo x90,Battery Capacity is Low ....All The Best In X90 VivoREAD MORE
vivo x90,Very goodREAD MORE
vivo x90,Nice photography and design..Performance also goodREAD MORE
vivo x90,Worst phone ever used.No premium phone feel.... Earlier I used X50Pro.. it's far better than this oneREAD MORE
vivo x90,Battery performance is average. 3 to 4 hour in normal use. Others feature is excelent.photo with flash is not goodREAD MORE
vivo x90,SupperREAD MORE
vivo x90,Not worth for the moneyREAD MORE
vivo x90,Nice mobileREAD MORE
vivo x90,Nice phoneREAD MORE
vivo x90,Mind-blowing experience with the cameraREAD MORE
vivo x90,Not good not bad quality so soREAD MORE
vivo x90,SuperbREAD MORE
vivo x90,Nice one no doubtREAD MORE
vivo x90,10/10 For Mobile Superb quality cameraREAD MORE
vivo x90,Budget flagship but need to improve osREAD MORE
vivo x90,"Very smooth, super fast charging which stays more than a day. I play games and use it for work continuously. The phone is well built, light weight with no heating issues yet. Highly recommended.READ MORE"
vivo x90,"Harrassed with purchased of x90, very poor phone by Vivo. Don't buy guysPoor display- fluctuations, whiteness and some times color are faded from display, line also appear in displayPoor service by Flipkart and seller- they are not cooperating.Poor processor and poor camera at this highest price.Don't buy this phone Vivo x90READ MORE"
vivo x90,Not badREAD MORE
vivo x90,Very poor camera when click picture so picture is going to auto blurREAD MORE
vivo x90,Very good product and flacsep. 💅READ MORE
vivo x90,All amazing productREAD MORE
vivo x90,"Its superb, and camera quality is awesome desgn also very coolREAD MORE"
vivo x90,"Gesture navigation doesn't work, app switch doesn't work.READ MORE"
vivo x90,Very bad experience I hate FlipkartREAD MORE
Phone Name,Review
oneplus 12,Good product for oneplusREAD MORE
oneplus 12,Camera quality superbREAD MORE
oneplus 12,Nice phone 👍Nice battery backup 🙂👍READ MORE
oneplus 12,Awesome Mobile.READ MORE
oneplus 12,Excellent 👌👌READ MORE
oneplus 12,Very nice phone in camera battery and performance.. go for itREAD MORE
oneplus 12,To loking good 🥰READ MORE
oneplus 12,Nice product camera quality super and speed processingREAD MORE
oneplus 12,Excellent phone I have ever experienced in every performance.......READ MORE
oneplus 12,ExcellentREAD MORE
oneplus 12,Very good product. Super fast charging in just 20 minutes. Awesome product.READ MORE
oneplus 12,It makes too much difference in the camera as compared to 11 or 12. Hassleblade is best.READ MORE
oneplus 12,GoodREAD MORE
oneplus 12,"OnePlus 12R is a perfect beast for those who want flagship grade performance, exceptional battery backup, great software experience, the best quality BOE Amoled Display with CGG Victus 2 protection, and finally a highly durable build with elegant design. Cameras have improved with updates but still they must need a lot of work. Overall, it is a well-rounded, refined and a value for money product.READ MORE"
oneplus 12,I am very happy ☺️☺️☺️ no words awesome iam BGMI lover processor Qualcomm Snapdragon 8 gen 2 🔥🔥🔥 thank u for FlipkartREAD MORE
oneplus 12,"Pros: The phone is faster than any other phone you will get for 45k. The phone has a superior display and great speaker. Oxygen OS is definitely a plus. Fast charging is better in this phone than in a lot of flagship phones. The camera is flash evey powerful.Cons: only the camera, camera could have been better. The photos aren't crispier and sharper. Should have come with a telephoto lens. I believe an update colREAD MORE"
oneplus 12,Good modelREAD MORE
oneplus 12,Thise phon superREAD MORE
oneplus 12,It's a flagship phone in this range but battery drained like water(similar to that it's an ultra fast charging 🤘✌️)and the worst is camera ! Needs improvement for that part...go for it don't hesitate if you're not a photographer!READ MORE
oneplus 12,Amazing phone fully satisfied.READ MORE
oneplus 12,Amazing experience. Premium feel. Battery lasts long. Display is so good. Just go for it.READ MORE
oneplus 12,Nice product from OnePlusREAD MORE
oneplus 12,"Awesome👌It's my first OnePlus phone, such a great experience I felt, Ultimate performance😘READ MORE"
oneplus 12,Worthy productREAD MORE
oneplus 12,Very nice 👍READ MORE
oneplus 12,Product  quality good Superb charging speed ultra fast charging Snapdragon 8gen 25500mah battery16gb ram256gb rom  And many more  extra featuresREAD MORE
oneplus 12,One of best in this segmentREAD MORE
oneplus 12,Super 😍READ MORE
oneplus 12,Product goodREAD MORE
oneplus 12,Crazy phone after my OnePlus 6 pls fix software bugs soonshree mahakalREAD MORE
oneplus 12,Good decision 👍READ MORE
oneplus 12,Best phone 📱READ MORE
oneplus 12,The phone is okay but some more features could have been added to it.READ MORE
oneplus 12,Good 💯😊READ MORE
oneplus 12,"Good , but the battery is draining fastREAD MORE"
oneplus 12,The best one plus so far top notch best camera its been over 6 months and so far no issues encounteredREAD MORE
oneplus 12,Outstanding 🔥 flagship phone 📱READ MORE
oneplus 12,best one phone smoothest phoneREAD MORE
oneplus 12,Good product.Worth of Money.READ MORE
oneplus 12,Good mobile .. battery and display superb Outstanding 😍READ MORE
oneplus 12,Really it's a nice phoneREAD MORE
oneplus 12,Great 👍READ MORE
oneplus 12,I loved it.thank u so muchREAD MORE
oneplus 12,Very good mobilREAD MORE
oneplus 12,Good mobileREAD MORE
oneplus 12,Good product...READ MORE
oneplus 12,Camera quality is not good sometimes it's taking back side light like a shadowREAD MORE
oneplus 12,Front camera below average Battery goodBack Camera is better.READ MORE
oneplus 12,I bought this for 45k it's bit high price for this phone. But if it's get under 38 k it'll be great.Display is great 5/5 Battery is 5/5 Update need to be fixed -4/5Charging too fast 100 w.. Camera its 3.5/5 . Camera need to be mora fixed at this price range...READ MORE
oneplus 12,Received the phone in a good condition. Extraordinary camera clarity and resolution. Very fast charging option. High speed performance.READ MORE
oneplus 12,Overall a great phone but better battery backup was expectedREAD MORE
oneplus 12,I just love the phone and camera quality.READ MORE
oneplus 12,"OnePlus mobile.. always my fav. This is my second handset from OnePlus, it is very smooth n light weight. The pack came with a back cover which was a sweet  surprise to me. Thank uREAD MORE"
oneplus 12,"This review is after 14 days. Received two updates. No question about performance, battery backup and display. The camera could have been a bit better although very good for daily use. Sometimes colour tones differ from actual. Network performance is also good but depends on the operator. My first phone 1+ phone. Overall I am satisfied with the product. I got it on offer around 37K.READ MORE"
oneplus 12,I loved the productREAD MORE
oneplus 12,Good phoneREAD MORE
oneplus 12,"Best phone , camera quality is superb, for gaming it's a good phone , charging speed is awesome within  15 to 20 minutes ,it charges well , so if you r travelling it's best thing for users,. Overall this is the best phone for me,READ MORE"
oneplus 12,OnePlus has always been my favourite brand and OnePlus 12R has raised the bar. Great phoneREAD MORE
oneplus 12,Curved screen causes issues with screen protector. Camera is avarage even in comparison with 3 year old S21 FE.Performance very good. Battery backup and charging speed are awREAD MORE
oneplus 12,SuperREAD MORE
oneplus 12,"Mobile performance is super and display and camera amazing,READ MORE"
oneplus 12,Good product..but little bit heavyREAD MORE
oneplus 12,Good phone but little weight otherwise superREAD MORE
oneplus 12,GOOD PRODUCT NICE PACKINGREAD MORE
oneplus 12,AwesomeREAD MORE
oneplus 12,Good productREAD MORE
oneplus 12,Best SmartphoneREAD MORE
oneplus 12,Back side camera design is looking not good but everything is perfect.READ MORE
oneplus 12,"Excellent device, loved it 😍😍😍READ MORE"
oneplus 12,Very Good Mobile Very smooth and Sensitive worth for money 😄😄READ MORE
oneplus 12,Nice writing best quality one plus 12rREAD MORE
oneplus 12,All goodREAD MORE
oneplus 12,Very Nice 👍READ MORE
oneplus 12,HappyREAD MORE
oneplus 12,Marvelous 😍😘 Excellent performance Mind blowing 😎READ MORE
oneplus 12,Best mobile in this priceREAD MORE
oneplus 12,If you want a camera phone this not for youREAD MORE
oneplus 12,"Smooth performance, absolutely beautiful camera quality, worth purchasingREAD MORE"
oneplus 12,Phone is v good for gaming and performance and battery backup is good 😊READ MORE
oneplus 12,Fantastic one plus 12R all performance very good thanks FlipkartREAD MORE
oneplus 12,According to price mobile is not worthy. Within one month mobile is hanging.READ MORE
oneplus 12,Phone case cover is in glass it broken one it fell down. so give good quality case cover. Other things are all good.READ MORE
oneplus 12,"I was expected a better smartphone in 40k but now I realise it was wrong move the camera is not good, battery is not as much good as I expected , lot of problems in working , always shows window update , a good phone but not worth of 40k its price should be around 25k to 30kREAD MORE"
oneplus 12,Camera is not good as expeREAD MORE
oneplus 12,"The OnePlus 12R has been a game changer, after 10 months of use, the experience remains impressive.Reliable battery  SUPERVOOC wired charging is incredibly fast going from 0 to 100% in under 30 minutesOverall, the OnePlus 12R has exceeded expectationsREAD MORE"
oneplus 12,"Amazing phone , amazing build quality, amazing screen size , first I am confused about cool blue color after delivery in hand , lovely color ......READ MORE"
oneplus 12,Geming phone 👍👍🎮🎮📱📱READ MORE
oneplus 12,Worth it to buyREAD MORE
oneplus 12,Brought (16/256 GB Variant)Pro:Super Smooth UI and App Animation.Gaming Performance is Best.BGMI (Smooth : Extreme+ or 90 FPS).Battery Life 1+ days Regular Uses.Charges within 25 Mins.Look and Hand Feel is Awesome.Display is Great with 4k+HDR support.Updates till Android 17 and Security Patches till January 2028.Cons:Average Ultra Wide Camera and Macro lens is of no use.Zooming is below Average.Company told 256 GB Variant is having UFS 4.0 but it is 3.1READ MORE
oneplus 12,When I started using the divice there is a little blinking black stripes on the screen. It's not the thing I have expected. The display has these issues with it.READ MORE
oneplus 12,Nice Display Super battery power Nice camera quality I like it ☺️READ MORE
oneplus 12,So far it's working goodREAD MORE
oneplus 12,Despite purchasing 16GB Ram variant sometimes I feel it's slow and gets stuckedREAD MORE
oneplus 12,Very good product 👍READ MORE
oneplus 12,Greater performance and long battery 💥READ MORE
oneplus 12,Not good this mobile 📲READ MORE
Phone Name,Review
galaxy z fold,Very nice 👌READ MORE
galaxy z fold,Best phoneREAD MORE
galaxy z fold,Best phREAD MORE
galaxy z fold,Amazing Phone with Amazing Features. just loved it. The high range Samsung phones are unbeatable.READ MORE
galaxy z fold,Great foldable with great design.READ MORE
galaxy z fold,Awesome lookingREAD MORE
Phone Name,Review
iphone 13,I switch to ios from android after 10 years so this review might help for migratorsIt’s been a month using the iPhone13 and this was my experience1. Design - its simple and no nonsense design . Expect white and pink rest of the colours are fingerprint magnets.  I have seen all the colours and I highly recommend the pink . It’s so light pink which makes it not girlish. See it for yourself it really looks so premium in light pink colour. For rest of it except white the aluminium frame wil...READ MORE
iphone 13,Great performance 🥰READ MORE
iphone 13,I upgraded to 13 from xs and my experience with this had been extraordinary . The user interface and the camera is too good .Just in love with this extraordinary device .I just shared some photos clicked from this phone so that everyone can have an idea about how good the camera is compared all other flagship devices . The lens inside the device is so efficient that it  automatically reduces the noise in the picture making it very crisp and clear  .READ MORE
iphone 13,"Awesome battery backup amazing camera, a all day batter backup  improved and brilliant IOs 16.1 oled display dolby speakers and lot more, just close your eyes and go for it. One of the best handy smartphones ever and in great discount given by flipkart in big billion days 🔥READ MORE"
iphone 13,This is awosome .. camera is best . Here some photos i m sharing with you guys ..READ MORE
iphone 13,Love this phone..... 😍READ MORE
