Phone Name,Review
nothing phone (2),Camera is nice Battery is excellentDisplay is super clearNice designREAD MORE
nothing phone (2),"Phone is really good. Really snappy. Each and every app loads very fast. Memory management is good. Design is also good but glyph is really a gimmick. Didn't use it till now.Display is very bright and clear. LTPO works like charm and saves battery. Battery backup and standby is good because of that.Camera is just average. Haptics could have better. Sometimes if phone is in my pocket, I have missed calls. Was not facing this with my previous OnePlus.Got phone at good price at big billion ...READ MORE"
nothing phone (2),"0 stars for Flipkart but Phone 10/10Fast and Smooth animations.Nothing OS 2.0 Monochrome theme Best tuned Snapdragon 8+ gen 1LTPO displayBest Camera Natural ColoursTop notch performanceBest Screen on time.And design you know it. Semi Transparent Design which shows inner elements of Phone battery, etc tightened screws, Useful glyph lights (not just showoff but also helpful), video recording Indicator. Wireless Charging A fresh breath of airREAD MORE"
nothing phone (2),Camera not goodBattery fantasticDisplay fantastic Nothing Os fantastic Performance so beautiful so elegant just looking wowCamera improvement requiredREAD MORE
nothing phone (2),"Love the haptics, lights, design, front display, bezels etc etc feels like a premium phone Cons are front cam is very average back  cam is fine that's allOs is so clean and minimalist love itI don't like that they don't give a charger and its overpriced I don't care about case I'll buy it but a charger is a must...READ MORE"
nothing phone (2),Everything is good except camera lot more need to improve and display no hrd in NetflixREAD MORE
nothing phone (2),"Software is one of best you can find out there. As clean as pixel software, very clean unique and awesome as well as usefulREAD MORE"
nothing phone (2),But one problem silent and general mode not show in status barNothing please update it short in status barREAD MORE
nothing phone (2),"Design:- premium build is awesome.Battery:- one day  for normal user 6 for heavy.Camera:- I think camera is better than OnePlus 11r.Performance:- 8+ gen 1 is best choice with nothing os, best software after one ui.Display:- superb display quality, i didn't like curved display so i am satisfied with flat display.Those who like curved displays should look for another phone.READ MORE"
nothing phone (2),"I love this phone, the best design with the powerful processor of 2023.But I think This phone is kinda overpriced, other than this phone is an allrounder.Preferred to purchase.👍READ MORE"
nothing phone (2),It's different than regular smartphones coz of glyphs. Good performance..very fast...no bloatwares at all...playing call of duty and pub g new state...no hanging at all...no heating issue...charger not included..only cable included...let's see how it performs in the long runREAD MORE
nothing phone (2),Very nice.....READ MORE
nothing phone (2),"One word- Fantastic product. The software experience is top notch. In a world of Vivos, samsungs, Oppos etc, near stock Android in its slick form is a bliss. I own a pixel 4A and can say the version of Android on this is better an dmore user friendly than the pixel. This alone is a reason good enough to get the nothing phone. The physical  design is quirky and some may like it and some may not, however the fit and finish is excellent. Ringtones are unconventional and I did not like any of it ...READ MORE"
nothing phone (2),GoodREAD MORE
nothing phone (2),A Good Overall PackageDesign - The design is premium with glass back and aluminium frame. Although the back glass is curved but the edges are sharp so buy a case asap. This phone will grab people's attention. It's upto you how you use the glyphs . You can use it for productivity or just for fun Display - Display is very vibrant and produces good colours. As this is a LTPO panel it is very goodSoftware - Stock Android with zero bloatware. The Nothing Skin on top feels really premium. Soft...READ MORE
nothing phone (2),"I bought this phone on 9 may and got this phone delivered to me next day. With card discount i got this phone for 33117 (8/128). My expectations were way high for this phone but this phone let me down. Before this i was using poco f1, so i reveiwing this phone keep xiaomi in mind so some of the guys may disagree.I bought this phone for the sake of clean android and this phone give one which is pros and con at the same time, let me explain. Due to clean experience it lags on developing its o...READ MORE"
nothing phone (2),"Nothing phone 2 Good or badIt's a mystery for me before buying the productBut now I cleared my mind and I want to say something about this productIf u want best Android I said best yes exactly u heard it right best Android then u should go for it.Nothing has done a polished and premium work on this productPros - Performance - it's the main reason to buy this products, it's feels like fluid, after hours of using I fail to heat this product 😁 its only warm for once while I am using it i...READ MORE"
nothing phone (2),Camera quality osmREAD MORE
nothing phone (2),Mind blowing design. Feels premium in hand. Super weight distribution. Decent camera. Buttery smooth UI and processor. Ultimate 1 day battery life. Best in class 5G with top speed with jio in Kerala. I love the monochrome themeREAD MORE
nothing phone (2),Charger not included. Performance is best.READ MORE
nothing phone (2),Good display camera and battery decent overall good product from nothing needed more customisation on osREAD MORE
nothing phone (2),Amazing phone. It's been a year since I bought it and no complaints at all. Received regular updates (2 months once security update). No lag and camera performance is also good. Definitely recommended.READ MORE
nothing phone (2),OwsamREAD MORE
nothing phone (2),Very nice productREAD MORE
nothing phone (2),It's a great phone for the price. It's fluid and smooth. But occasionally it has a bug which disables mobile network and needs a restart to fix it other than that it's a great phoneREAD MORE
nothing phone (2),Excellent phoneREAD MORE
nothing phone (2),Phone is good in performance but a great improvement need in camera 📸READ MORE
nothing phone (2),You can use this phone without a doubt. This phone has a character in it not like other phones It feels so premium in the hands Glad I bought it after so long of waitREAD MORE
nothing phone (2),"I recently shifted from Xiomi to Nothing and the experience was too good. It's battery, performance and design was very well balanced and it's not a boring phone like others, it's camera quality decrease in dim light but glyph solves that problem. I truly recommend this phone to others.READ MORE"
nothing phone (2),"Everything is perfect except camera, overall the camera is also good but need some work on picture noise and during mobile flash time photo.READ MORE"
nothing phone (2),After using 2 weeks I can say nothing Phone 2 is one of best Android phone at present in market. Small improvement are required in selfie camera. I hope they can improve in up coming update. Other than this phone is superb. Battery backup also good. Main camera is good. Video recording is good but if they can improve little bit it can become perfect camera phone. Flipkart delivery and pickup old phone is also good this time.READ MORE
nothing phone (2),"The back seems like plastic a bit. But when compared to pixel 7 I think it's more better. This is not for photography people but doesn't mean camera isn't great but it's just that not as cool as it is in other rivals. The 120hz refresh rate is fire. The phone is quite big and the smooth OS. The back lights truly are psych. More over, ip54 is bit of a compromise. But likewise pick any phone we got to compromise on something eventually. But ip54 is sufficient for daily uses like rain water and ...READ MORE"
nothing phone (2),NiceREAD MORE
nothing phone (2),Good value for the money deviceDo not expect much on camera and display both are just fineREAD MORE
nothing phone (2),Overall Looks and personal is absolutely fantastic. But slightly disappointed with camera performance...READ MORE
nothing phone (2),Really a good product under 40k. Camera quality is good. Best thing is battery which lasts for a day.READ MORE
nothing phone (2),"Perfect premium design,sounds good,Display superbPerformance goodRear camera superFront camera average Battery life goodGlyphs are eye cacheGives iphone feeling in hand✋Totally super cool device 🥰Atleast case should be givenREAD MORE"
nothing phone (2),Good worth itREAD MORE
nothing phone (2),Nice Mobile and Nice futureREAD MORE
nothing phone (2),"The camera is ok not that good for a 40k phone but the performance, display, battery and software experience is very goodREAD MORE"
nothing phone (2),"Purchased this mobile at Flipkart Big Billion days sales basic model 35KNow we are getting 12GB and 256 GB varient for 29999 only.After 6 months of usage My Observation is Camera and Display quality is good.As I'm not a Gamer performance is also Good.But In Summer the battery drained very fast The mobile is getting heated a lot and you can't use it without a pouch.So , Overall average phone Heating problem is there.Note : I'm using a CMF charger only.READ MORE"
nothing phone (2),I'm okay with phone but I'm not satisfied with the camera part iam not happyREAD MORE
nothing phone (2),Phone is very heavy and it is overpriced alsoREAD MORE
nothing phone (2),Design 5* performance 5* battery 4* display 5*READ MORE
nothing phone (2),Review after use of 20 daysOverall a good phone in BBD sale price with all offers.Battery is well optimised and backup is solid considering 4700 mahcamera is better than samsung phone at the same pricePerformance is good enough .Software needs some improvement which is under consideration by the company and giving regular updates.I am using a Samsung 25 watt charger and full charging takes 50 minutes on 20% balance battery so charging speed is not an issue for me.READ MORE
nothing phone (2),"Good phone, camera could be betterREAD MORE"
nothing phone (2),Amazing phone and amazing performance.I really like nothing phone 2.READ MORE
nothing phone (2),Good 🤍READ MORE
nothing phone (2),This is a good phone but the price is a little higher if the price is around 37000 would be better in my opinion.READ MORE
nothing phone (2),"The camera could be better. Nothing, please give us a good update for the camera.READ MORE"
nothing phone (2),A balanced phone.everything is good..Low light photos should be better..👍👍READ MORE
nothing phone (2),Its just 5 months and its charging cord stopped working. #sadREAD MORE
nothing phone (2),"Camera is completely disappointed, not even close to my old mobile OnePlus 10R.READ MORE"
nothing phone (2),good hardware. trash software. better off using custom software on this if atall.READ MORE
nothing phone (2),Touch issue lagging not god responsREAD MORE
nothing phone (2),Glyphs is good but one or two days we will use glyphs light after that we will not use that for all the time and other then that phone goodREAD MORE
nothing phone (2),Best phone in this price segment... Camera -4/5Performance -5/5Battery 🔋-5/5Display -5/5Design -5/5.Go for it without hesitation...💯READ MORE
nothing phone (2),Tooooo gudREAD MORE
nothing phone (2),Definitely the best Mid ranger of 2023 with the best user experience!Camera is kinda average sometimes but the portrait mode is soo awesome!(I will pin some portraits)For me the Glyph is pretty useful so I'm liking it alot.READ MORE
nothing phone (2),"Shall add a extra color mode. Colors look lackluster compared to similarly priced phones, but real.READ MORE"
nothing phone (2),"Very good phone, charging speed should have been little bit extra faster, camera is good at this price range, expecting that nothing will improve the camera with upcoming software updates, satisfied.READ MORE"
nothing phone (2),Good qualityREAD MORE
nothing phone (2),I have nothingREAD MORE
nothing phone (2),Best in class fast snappy Camera is not bad but not best either Design is too good Software is the best thing about the phoneREAD MORE
nothing phone (2),Got it for 32599 on BBDWith exchange and bank offerPros✨ Great Design similar to 14pro✨Great ui and widget and overall customisation is awesome✨ Performance is smooth like butter extremely satisfied8+gen1 is killer vfm.✨ Decent Battery backup✨ Camera is ok for this price range lot of major improvements through software updates✨ Regular updates and bug fixes✨ Decent haptics and sound qualityCons✨No charger in the box✨ Yellowing of gliph light✨Poor pre applied screen guard✨Low ...READ MORE
nothing phone (2),Looks are awesome.Battery is really goodCamera is also good Ltpo panel is bright and good for content.Over all good phoneREAD MORE
nothing phone (2),"Very nice phone 😍😘😘I think camera may be improvedBut UI experience, performance and hepatic are awesome 😍😍 I really love this device 😘😘READ MORE"
nothing phone (2),Amazing phone! Rather than haptics everything is great. camera is one of the best!READ MORE
nothing phone (2),In one word it's just WOW!!Need to work on camera department especially in photos but In shooting videos its rockzzz.Camera-4⭐Haptic feedback -5⭐Display-5⭐Looks-5⭐Performance -5⭐Battery-5⭐Hope It helps.READ MORE
nothing phone (2),Fantastic 😍..READ MORE
nothing phone (2),"It's just perfect just perfect, it's easily go against and even defeat any rs.60k phone present in market in terms of speed and capabilities.Buy it.READ MORE"
nothing phone (2),Worst Camera 🤬READ MORE
nothing phone (2),PerformanceREAD MORE
nothing phone (2),"Review after a year of usage -Pros - Very good network quality, excellent call quality and internet speed.Excellent build quality.Good battery life, easily lasts 1 - 1.5 days.Main and ultrawide rear cameras take detailed pictures during daytime as well as night most of the time. Sometimes, photos turn out inconsistent with wrong colours, blurred or soft. Videos shot are very good in daytime, ok at night.Front camera takes good shots in daytime, even portrait shots. Night time shots are...READ MORE"
nothing phone (2),OutstandingREAD MORE
nothing phone (2),"The design was unique and attractive.Camera takes awesome picture with Best QUALITY and smooth software experience I didn't noticed any kind of lag and UNIQUE OS. WHICH MAKES QUITE IMPRESSIVE THAN APPLE OS, AND MAINLY GLYPH LIGHTS ARE VERY USEFUL IN THE NIGHT PHOTOGRAPHY AND GIVING AMAZING RESULTS IN THE FORM OF PHOTOS IT'S BETTER THAN PIXEL AND APPLE IN THE CASE OF NIGHT PHOTOGRAPHY.READ MORE"
nothing phone (2),Value for money 🤞🙏🏻READ MORE
nothing phone (2),Worth for moneyREAD MORE
nothing phone (2),The feels premium and is light in weigh . Performance is preety good  considering the price point at which I got this phone.READ MORE
nothing phone (2),I purchased it under 30k and believe me in this price segment this is one of the best phone..READ MORE
nothing phone (2),This phone is getting overheating within some months after it's purchase. Battery back up is getting to some hours. Phone not at all worth to buy this kind of phone with heavy price as 40K.READ MORE
nothing phone (2),Average ratingREAD MORE
nothing phone (2),"It's a great phone in the mid-range category (30k-35k) but not more than that. The software does fail sometimes and the phone battery is not great. The phone charger is not included. It is difficult to find accessories for this phone.If you're looking for a different looking phone, this is for you else you can go for other phones in the 25-30k category.READ MORE"
nothing phone (2),AwsmREAD MORE
nothing phone (2),Worst performance 😔READ MORE
nothing phone (2),The camera gives weird results sometimes but you can download gcam and improve it toREAD MORE
nothing phone (2),Nice phone in all conditionNice looking  phoneREAD MORE
nothing phone (2),Bang for the buck.READ MORE
nothing phone (2),EverythingREAD MORE
nothing phone (2),I buy this phone recently after 2 days it will be Hanged and didn't work any switch button after sometime automatically reboot. I think some problem but after 9 days Same thing happened againSo I want to tell others to get any other phone but nothing Phone 2 . The rest is up to you.READ MORE
nothing phone (2),It is a good phoneREAD MORE
nothing phone (2),The best mobile all-rounderREAD MORE
nothing phone (2),Intuitive Product.READ MORE
nothing phone (2),So beautiful so elegant Just looking a woowREAD MORE
nothing phone (2),Wow so looking is good.very nice disagin best   phone.READ MORE
nothing phone (2),"Design is best, this phone UI is very smooth an unique experienceREAD MORE"
nothing phone (2),GreatREAD MORE
Phone Name,Review
google pixel 9,Overall experience superb..READ MORE
google pixel 9,Camera with this phone just kills my iphone 14 pro.Now i want to switch from from ios to android this thing is so good and smooth.READ MORE
google pixel 9,"Upgraded from Pixel 4A to Pixel 9. Fantastic upgrade, improved camera, solid built quality, no heating issue, amazing photo editing software and much long lasted battery than my previous one. Overall feels very smooth performance and wonderful AI experience.READ MORE"
google pixel 9,Outstanding 🥰 loved itREAD MORE
google pixel 9,Great experience so far!Design is awesome!Camera is 9/10Battery 9/10Performance 10/10Design 10/10Sound 10/10Video 10/10 (2160P on YT)READ MORE
google pixel 9,"I am very happy this Pixel exists. The phone is fast, feels like it already knows your next step/action. No stutters, don't fall for criticism on G4, I had my doubts now I don't, it's very well optimised 👌If you want that peak raw performance for very heavy tasks then this might not be for you. I played codm and bgmi for an hour straight didn't heat and gameplay was good and daily usage is smooth af! Pixel UI is just a bliss to use 🫶Camera I need not mention, it's really good, vide...READ MORE"
google pixel 9,"Absolutely fantastic. I switched over from iPhone 13 pro. Quick commentsFantastic screenGreat hapticsVery good cameraVery less heating Signal(my area and usage) no difference between iPhone, Samsung and pixel 9. Very quick and fast finger print sensor(choose a tempered glass that supports this) Good battery life(two days of usage) Very smooth and fast performance on daily usage(I don't play games)READ MORE"
google pixel 9,"Upgraded from my pixel 6a and honestly much better improvement in all aspects.Camera is great as always, design is by far the best and feels like a flagship premium deviceThe battery has been improved as it lasts for more than a day. No heating issues are faced so far as well :)The only con is the charging speed is still very slow as compared to other premium phones, it takes more than 1.5 hours for full charge.READ MORE"
google pixel 9,"Review from a long term Iphone User:( Exchanged my Iphone 14Pro)Camera Performance:The Pixel 9's camera has consistently impressed me, particularly in low-light environments. The AI-driven image processing is exceptional, capturing intricate details and vibrant colors. While I have occasionally observed slight overexposure or blown-out highlights in bright lighting conditions, these are minor issues that don't significantly detract from the overall quality. I believe a software update co...READ MORE"
google pixel 9,What a mind blowing device it has everything to go on topREAD MORE
google pixel 9,Mind blowing google rocks 👌💪👍READ MORE
google pixel 9,"Review after using Pixel 9 for one month:I bought this during the sale with cashback and exchange for around 61k, which was a decent price.I was using OnePlus 7t for the past 5 years and upgraded to this device as I'm not a big fan of apple. This did not disappoint me. It's great update from OnePlus 7t which itself was a great phone to use.Pros:1. The build quality is great.2. The size is quite handy, this phone will definitely suit you if you prefer a smaller phone.3. Battery lasts ...READ MORE"
google pixel 9,Best AI PHONE......I just love itREAD MORE
google pixel 9,This is really a premium display with lot's of A feature I have last 3 to 4 days performance was awesome with killing Camera love this product 😍 thanks filpkart ....READ MORE
google pixel 9,Google pixel is one phone you should go for never disappointing. If you are going for a regular and user friendly it's the best. Camera is best in he segment plus AI is good for editing your pictures.READ MORE
google pixel 9,"Best software experience including AI features, good battery life and a great camera with 7 years of software support... Loved itREAD MORE"
google pixel 9,"Fantastic Phone with an amazing point and shoot camera. The video quality is very good. And the display compliments the camera so well. The HDR photos look like Chef's Kiss. However, performance is not justified for the price, you can see the phone struggle when you're trying to multi task hard, it'll get warm but it's miles better than the previous series which used to run warm always. However, during normal usage, like taking calls, watching videos, using the camera in burst it behaves like...READ MORE"
google pixel 9,"The performance of the phone is very good, in terms of security, it needs to improve a bit, like the app lock such things.If we use screen guard / I  mean temper gaurd  for google pixel 9 phone, in display the fingerprint sensor is not working properly.READ MORE"
google pixel 9,"Camera is good, battery and performance needs to be improved.Good to buy in BBD with offersREAD MORE"
google pixel 9,The phone's performance is really impressive so far.READ MORE
google pixel 9,Superb phone with an awesome camera and nice haptics. Battery life has been improved from past pixels. 10/10READ MORE
google pixel 9,"Upgrading from the Pixel 6a to the Pixel 9 is definitely worth it, especially for camera enthusiasts. The Pixel 9 excels in night photography with stunning clarity and detail.READ MORE"
google pixel 9,"It is a premium smartphone as premium and smart as they can get. + Looks and feels extremely premium.+ Built well, very comfortable and sturdy.+ Screen quality is superb and it gets super bright and low.+ Sound quality is stereo and Awesome!! Even my bluetooth earphones sound better.+ Battery life seems great, it is draining very slowly.+ Fast and smooth performance.+ Great cameras needless to say.+ Interesting and useful AI features.This is a great wholesome phone other than the c...READ MORE"
google pixel 9,"The best phone is this segment with great AI features, design is quite premium but quite similar to iPhone. Using it for last 2 week..no heating issues faced as such. The android experience is better than any other phoneREAD MORE"
google pixel 9,"My 2nd Pixel Phone ... from 6A to pixel 9...Camera, Software updates are too good... Battery Performance can be improved...Else it's an outstanding pickREAD MORE"
google pixel 9,"Great product. Google has finally done it. In pixel 7 and below, there is a heating problem, camera used to take its own sweet time, battery was average.Enter Pixel 9.Pros: 1. Battery: great battery, standby is top notch, it beats my Asus Rog phone 3 with a higher battery capacity.2. Camera: no complaints. One of the best. The add me feature is great, but I think after a few days no-one is gonna use add-me.3. Build: what a premium build, feels like you are holding a beast. The camera bu...READ MORE"
google pixel 9,My first PIXEL phone ever.I started loving it already.Nice build quality and software experience.Camera and battery backup seems to be pretty decent.I updated to ANDROID 15 BETA and no major glitches so far in my day to day usage.Haven't faced any heating issues so far.Hoping to keep the phone for at least the next couple of years.READ MORE
google pixel 9,"Good improvements compared to previous version, looks exactly like iphone, Price is very high.READ MORE"
google pixel 9,"Sharing my 2 months experience with pixel 9 is going great in all aspects. I have upgraded from Pixel 6a to Pixel 9.. And there are a lot of improvements in Camera, Battery life, Phone heating issue. Overall, I loved the Pixel 9 and the camera is amazing and can easily beat recent Iphone Cameras.Attached photos and video for camera quality.Wintergreen color is Awesome.READ MORE"
google pixel 9,Excellent one iphone is nothing.READ MORE
google pixel 9,I've been using P9 for past 15 days and the device is just awesome. There are still some heating issues while using maps or cameras for a longer time. The battery has definitely been improved compared to previous pixel mobiles. Looks and feel is premium.Display and camera are fantabulous.READ MORE
google pixel 9,"Switched to Pixel from iphone. Phone has more premium touch and feel, looks elegant and photography is awesome.AI features makes it a must buy. Screen is much better than iphones non-pro models and does not cause any strain on eyes. Small inhouse tools in the phone makes life easier.READ MORE"
google pixel 9,"Amazing product by Google, hopefully it will age well with tensor 4READ MORE"
google pixel 9,Exchange Google pixel 4a mobile. Pixel 9 is excellent mobile with build quality and camera is awesome. Battery backup is also awesome.READ MORE
google pixel 9,It was awesome ....the design and touch everything is too good .. especially the camera and the features like add me and all  are coo.....there is issue with heat ..when I using the phone I felt like a heating issue ..pixel need to work on that heating issue ... LlREAD MORE
google pixel 9,Great phone at a great price on BBD. The camera quality is killer.READ MORE
